<?xml version="1.0" encoding="UTF-8" standalone="yes"?>
<note xmlns:xsi="http://www.w3.org/2001/XMLSchema-instance" xsi:noNamespaceSchemaLocation="./nota.xsd">
  <to>Tove</to>
  <from>Jani</from>
  <heading>Reminder</heading>
  <body>Dont forget me this weekend</body>
  <direcciones>
    <address>
      <origen></origen>
      <destino></destino>
    </address>
    <address calle="orion">
      <origen></origen>
      <destino></destino>
    </address>
    <address calle="orion">
      <origen></origen>
      <destino></destino>
    </address>
  </direcciones>
</note>